{
  "$defs": {
    "SessionRef": {
      "description": "One live session incarnation (`proto/ncp.proto` `SessionRef`). The routing\n`session_id` (carried alongside on every session-scoped frame) remains the logical\nname; this server-issued `generation` distinguishes one opening of that id from a\nlater reuse, so a stale-session frame is rejectable. The pair\n`(session_id, generation)` identifies the live instance; `\"\"` = unset.",
      "properties": {
        "generation": {
          "default": "",
          "type": "string"
        }
      },
      "type": "object"
    },
    "StreamPosition": {
      "description": "One exact position in ONE logical stream incarnation (`proto/ncp.proto`\n`StreamPosition`). Wire 0.8 splits the old overloaded top-level `seq` into a\nframe's OWN [`stream`](SensorFrame) — the only sequence loss/`LinkMonitor`/\n`ActionBuffer` accounting reads — and a `source` referencing the frame that drove\nit (correlation only, never loss accounting).\n\n`epoch` is an opaque per-incarnation id (canonical lowercase UUIDv4), compared for\nEQUALITY ONLY — never ordered, never a timestamp. `seq` starts at 1 per epoch,\nstrictly increasing, within `1 ..= JSON_SAFE_INTEGER_MAX`. The `\"\"`/`0` default is\n\"unset\" and is not wire-legal until stamped (mirrors the retired `seq` discipline).",
      "properties": {
        "epoch": {
          "default": "",
          "type": "string"
        },
        "seq": {
          "default": 0,
          "format": "int64",
          "maximum": 9007199254740991,
          "minimum": -9007199254740991,
          "type": "integer"
        }
      },
      "type": "object"
    }
  },
  "$schema": "https://json-schema.org/draft/2020-12/schema",
  "description": "Link-health telemetry from the seq-gap / CUSUM monitor (published on the\ncontrol plane). `burst=true` flags sustained loss — a possible jam — at which\npoint the only sound response is to fail safe, not add redundancy. `t` is\nproducer-local monotonic seconds and is never compared across peers.",
  "properties": {
    "burst": {
      "type": "boolean"
    },
    "kind": {
      "const": "link_status",
      "type": "string"
    },
    "last_arrival_seq": {
      "default": null,
      "description": "F-16: seq of the last valid in-epoch ARRIVAL (`< observed_stream.seq` under\nreordering; `==` it on forward arrival). Range starts at 1, cannot exceed the\nobserved high-water, and presence tracks `observed_stream`.",
      "format": "int64",
      "maximum": 9007199254740991,
      "minimum": -9007199254740991,
      "type": [
        "integer",
        "null"
      ]
    },
    "loss_rate": {
      "format": "double",
      "type": "number"
    },
    "lost": {
      "format": "int64",
      "maximum": 9007199254740991,
      "minimum": -9007199254740991,
      "type": "integer"
    },
    "ncp_version": {
      "pattern": "^1(?:\\.(?:0|[1-9][0-9]{0,18}|1[0-7][0-9]{18}|18[0-3][0-9]{17}|184[0-3][0-9]{16}|1844[0-5][0-9]{15}|18446[0-6][0-9]{14}|184467[0-3][0-9]{13}|1844674[0-3][0-9]{12}|184467440[0-6][0-9]{10}|1844674407[0-2][0-9]{9}|18446744073[0-6][0-9]{8}|1844674407370[0-8][0-9]{6}|18446744073709[0-4][0-9]{5}|184467440737095[0-4][0-9]{4}|18446744073709550[0-9]{3}|18446744073709551[0-5][0-9]{2}|1844674407370955160[0-9]{1}|1844674407370955161[0-4]|18446744073709551615))?(?![\\s\\S])",
      "type": "string"
    },
    "observed_stream": {
      "anyOf": [
        {
          "$ref": "#/$defs/StreamPosition"
        },
        {
          "type": "null"
        }
      ],
      "default": null,
      "description": "The MONITORED stream's epoch + forward high-water seq; absent before the first\nvalid observed frame (presence tracks `last_arrival_seq`). Its seq starts at\n1 and is the forward high-water."
    },
    "received": {
      "format": "int64",
      "maximum": 9007199254740991,
      "minimum": -9007199254740991,
      "type": "integer"
    },
    "session": {
      "$ref": "#/$defs/SessionRef",
      "description": "The live session incarnation."
    },
    "session_id": {
      "type": "string"
    },
    "stream": {
      "$ref": "#/$defs/StreamPosition",
      "description": "The LinkStatus stream's own incarnation + strictly positive position —\nvalidate this before trusting any reported burst/loss/high-water state."
    },
    "t": {
      "format": "double",
      "type": "number"
    }
  },
  "required": [
    "burst",
    "kind",
    "loss_rate",
    "lost",
    "ncp_version",
    "received",
    "session",
    "session_id",
    "stream",
    "t"
  ],
  "title": "LinkStatus",
  "type": "object"
}
